{
  "version": 1,
  "assetRoot": "app/src/main/assets/models",
  "description": "Authoritative production manifest for large on-device model assets. Bundled entries are packaged directly in app/src/main/assets/models and must match the exact byte size and SHA-256 checksum recorded here.",
  "models": [
    {
      "id": "gatekeeper_bert_vocab",
      "filename": "bert_vocab.txt",
      "delivery": "bundled",
      "sha256": "07eced375cec144d27c900241f3e339478dec958f92fddbc551f295c992038a3",
      "sizeBytes": 231508,
      "mediaType": "text/plain",
      "required": true
    },
    {
      "id": "gatekeeper_bert_v0_cpu",
      "filename": "bert_v0_cpu.tflite",
      "delivery": "bundled",
      "sha256": "1c6da7858a1cccd9ac6cd5c323d26ef99d962761e34d3f65871762123f95af34",
      "sizeBytes": 71935326,
      "mediaType": "application/vnd.tensorflow.lite",
      "required": true
    },
    {
      "id": "gatekeeper_bert_v0_p24",
      "filename": "bert_v0_p24.tflite",
      "delivery": "bundled",
      "sha256": "95142cbaaf2102c62e095c16a352cb19c8c05369859922fcbddc5699a8c903c8",
      "sizeBytes": 44995072,
      "mediaType": "application/vnd.tensorflow.lite",
      "required": false
    },
    {
      "id": "gatekeeper_bert_v0_p25",
      "filename": "bert_v0_p25.tflite",
      "delivery": "bundled",
      "sha256": "f9099cd4b718b64e78ee021fb59a2c1a5581e918bcaff965665f0591de2b6e80",
      "sizeBytes": 46246528,
      "mediaType": "application/vnd.tensorflow.lite",
      "required": false
    },
    {
      "id": "gatekeeper_bert_v0_mt6989",
      "filename": "bert_v0_mt6989.tflite",
      "delivery": "bundled",
      "sha256": "0000000000000000000000000000000000000000000000000000000000000000",
      "sizeBytes": 1,
      "mediaType": "application/vnd.tensorflow.lite",
      "required": false
    },
    {
      "id": "gatekeeper_audio_frontend",
      "filename": "audio_frontend.tflite",
      "delivery": "bundled",
      "sha256": "f1dbb89e2f585093515de68e873d2beb7a5058e25a76b932fc6628937d13b457",
      "sizeBytes": 3018776,
      "mediaType": "application/vnd.tensorflow.lite",
      "required": true
    },
    {
      "id": "gatekeeper_audio_gatekeeper",
      "filename": "audio_gatekeeper_edgetpu.tflite",
      "delivery": "bundled",
      "sha256": "a1388e523b7786800e0fdd8da4c2a7e4400aeb6781824ea234064e03844206f2",
      "sizeBytes": 48156352,
      "mediaType": "application/vnd.tensorflow.lite",
      "required": true
    },
    {
      "id": "gatekeeper_inherent_v0",
      "filename": "inherent.tflite",
      "delivery": "bundled",
      "sha256": "b44af13a3f0b3683a46b65f790853d6aa6e709d14da3fab164eb1efa0f375065",
      "sizeBytes": 254368,
      "mediaType": "application/vnd.tensorflow.lite",
      "required": true
    },
    {
      "id": "gatekeeper_inherent_v0_metadata",
      "filename": "inherent.metadata.json",
      "delivery": "bundled",
      "sha256": "c123cdaed47377c9d411e51cee388f4a549d80ee8f413575315e7bd518a4655e",
      "sizeBytes": 3895,
      "mediaType": "application/json",
      "required": true
    }
  ]
}
